{"$schema":"https://json-schema.org/draft/2020-12/schema","$id":"https://r8-kumamoto-saigai.local/schemas/reconstruction/application.schema.json","type":"array","items":{"type":"object","additionalProperties":false,"required":["id","programId","disasterId","municipalityIds","applicationStatus","effectiveFrom","effectiveUntil","eligibleDamage","eligibilityConditions","specialRules","supportDescription","amountDescription","applicationMethod","applicationPeriodIds","requiredDocumentIds","contactPointIds","sourceLinkIds","publicationStatus","verificationStatus","freshnessStatus","lastCheckedAt","notes"],"properties":{"id":{"type":"string","pattern":"^application_[a-z0-9_]+$"},"programId":{"type":"string"},"disasterId":{"type":"string"},"municipalityIds":{"$ref":"common.schema.json#/$defs/idArray"},"applicationStatus":{"$ref":"common.schema.json#/$defs/applicationStatus"},"effectiveFrom":{"$ref":"common.schema.json#/$defs/nullableDateOrDateTime"},"effectiveUntil":{"$ref":"common.schema.json#/$defs/nullableDateOrDateTime"},"eligibleDamage":{"type":"array","items":{"type":"string"}},"eligibilityConditions":{"type":"array","items":{"type":"object"}},"specialRules":{"type":["string","null"]},"supportDescription":{"type":["string","null"]},"amountDescription":{"type":["string","null"]},"applicationMethod":{"type":["string","null"]},"applicationPeriodIds":{"$ref":"common.schema.json#/$defs/idArray"},"requiredDocumentIds":{"$ref":"common.schema.json#/$defs/idArray"},"contactPointIds":{"$ref":"common.schema.json#/$defs/idArray"},"sourceLinkIds":{"$ref":"common.schema.json#/$defs/idArray"},"publicationStatus":{"$ref":"common.schema.json#/$defs/publicationStatus"},"verificationStatus":{"$ref":"common.schema.json#/$defs/verificationStatus"},"freshnessStatus":{"$ref":"common.schema.json#/$defs/freshnessStatus"},"lastCheckedAt":{"$ref":"common.schema.json#/$defs/nullableDateOrDateTime"},"notes":{"type":["string","null"]}}}}
