[
  {
    "id": "application_r8_kumamoto_livelihood_reconstruction_pending",
    "programId": "program_livelihood_reconstruction_support_grant",
    "disasterId": "disaster_2026_kumamoto_earthquake",
    "municipalityIds": [],
    "applicationStatus": "pending",
    "effectiveFrom": null,
    "effectiveUntil": null,
    "eligibleDamage": [],
    "eligibilityConditions": [],
    "specialRules": null,
    "supportDescription": null,
    "amountDescription": null,
    "applicationMethod": null,
    "applicationPeriodIds": [],
    "requiredDocumentIds": [],
    "contactPointIds": [],
    "sourceLinkIds": [],
    "publicationStatus": "draft",
    "verificationStatus": "pending",
    "freshnessStatus": "review_due",
    "lastCheckedAt": null,
    "notes": "今回の災害への適用、地域、条件、期限、窓口は未確認。"
  },
  {
    "id": "application_r8_kumamoto_emergency_repair",
    "programId": "program_emergency_housing_repair",
    "disasterId": "disaster_2026_kumamoto_earthquake",
    "municipalityIds": ["municipality_yatsushiro", "municipality_minamata", "municipality_yamaga", "municipality_kikuchi", "municipality_uto", "municipality_kamiamakusa", "municipality_uki", "municipality_amakusa", "municipality_koshi", "municipality_misato", "municipality_ozu", "municipality_kikuyo", "municipality_nishihara", "municipality_mifune", "municipality_kashima", "municipality_mashiki", "municipality_kosa", "municipality_hikawa", "municipality_ashikita", "municipality_tsunagi"],
    "applicationStatus": "active",
    "effectiveFrom": "2026-07-28",
    "effectiveUntil": null,
    "eligibleDamage": ["全壊（修理により居住可能となる場合）", "大規模半壊", "中規模半壊", "半壊", "準半壊"],
    "eligibilityConditions": [
      {"id":"condition_repair_damage_and_resources","field":"housing_damage","description":"大規模半壊、または中規模半壊・半壊・準半壊で自らの資力では応急修理できないこと","plainLanguageDescription":"住家被害区分と、修理費を自力で負担できるかについて条件があります。市町村が公式書類等で確認します。","operator":"description_only","value":null,"logicalGroup":"repair_eligibility","groupOperator":"AND","certainty":"confirmed","scope":"disaster_application","municipalityIds":[],"sourceLinkIds":["source_link_application_repair_eligibility","source_link_application_repair_damage"],"checkedAt":"2026-08-09T18:03:00+09:00","verificationStatus":"partially_verified"},
      {"id":"condition_repair_current_habitability","field":"residency_status","description":"日常生活に必要な部分の被害により、現状では住めないこと","plainLanguageDescription":"今の状態で生活できるかを確認します。本サイトは写真や自己申告から判定しません。","operator":"description_only","value":null,"logicalGroup":"repair_eligibility","groupOperator":"AND","certainty":"confirmed","scope":"disaster_application","municipalityIds":[],"sourceLinkIds":["source_link_application_repair_eligibility","source_link_application_repair_scope"],"checkedAt":"2026-08-09T18:03:00+09:00","verificationStatus":"partially_verified"},
      {"id":"condition_repair_expected_habitability","field":"residency_status","description":"応急修理を行うことで住めるようになると見込まれること","plainLanguageDescription":"必要な部分を修理した後、その家で生活できる見込みを市町村へ確認します。","operator":"description_only","value":null,"logicalGroup":"repair_eligibility","groupOperator":"AND","certainty":"confirmed","scope":"disaster_application","municipalityIds":[],"sourceLinkIds":["source_link_application_repair_eligibility"],"checkedAt":"2026-08-09T18:03:00+09:00","verificationStatus":"partially_verified"}
    ],
    "specialRules": "全壊は原則対象外ですが、修理により居住可能となる場合は対象となり得ます。中規模半壊以下の資力要件は『資力に関する申出書』で確認されます。",
    "supportDescription": "市町村が修理業者へ依頼し、屋根等の基本部分、ドア等の開口部、上下水道等の配管・配線、トイレ等の衛生設備など、日常生活に必要な最小限度の部分を修理します。",
    "amountDescription": "1世帯あたり、全壊・大規模半壊・中規模半壊・半壊は税込75万7千円以内、準半壊は税込36万7千円以内です。",
    "applicationMethod": "被災した市町村の窓口へ申込みます。市町村ごとに準備が整い次第受付開始とされており、宇土市固有の受付詳細は確認中です。",
    "applicationPeriodIds": ["period_r8_kumamoto_emergency_repair_application_pending"],
    "requiredDocumentIds": ["document_repair_application_form", "document_housing_damage_statement", "document_disaster_certificate", "document_pre_repair_photos", "document_repair_estimate", "document_financial_resources_statement", "document_repair_application_checklist"],
    "contactPointIds": ["contact_kumamoto_prefecture_housing_measures_team"],
    "sourceLinkIds": ["source_link_application_repair_implemented", "source_link_application_repair_areas", "source_link_application_repair_eligibility", "source_link_application_repair_damage", "source_link_application_repair_scope", "source_link_application_repair_amount", "source_link_application_repair_office", "source_link_application_repair_uto_pending"],
    "publicationStatus": "draft",
    "verificationStatus": "partially_verified",
    "freshnessStatus": "fresh",
    "lastCheckedAt": "2026-08-09T18:03:00+09:00",
    "notes": "熊本市を除く県実施20市町村への適用・条件・金額は熊本県一次情報で確認。熊本市は救助実施市として別途実施するため本適用レコードには含めない。宇土市固有の担当課、受付開始日、連絡先、申込期限、工事完了期限は確認中。"
  }
]
